Department,Description,ContactEmail
CSE,Computer Science and Engineering department focusing on software, AI, and systems.,cse-office@example.edu
ECE,Electronics and Communication Engineering with labs in VLSI, embedded, and communication systems.,ece-office@example.edu
ME,Mechanical Engineering covering design, manufacturing, and thermal engineering.,me-office@example.edu
ADMIN,Administration office handling admissions, fees, and general queries.,admin-office@example.edu
EXAM CELL,Exam cell responsible for exam scheduling, hall allocation, and results.,exam-cell@example.edu
